vocab_id,word,level,unit_number,unit_title,part_of_speech,definition_ar,example_en,has_audio,has_image,keep_id,reason
ea2721ef-8c81-4ac0-8d61-13ce9d74e2c8,exquisite,5,7,Neuroscience Frontiers,adjective,رائع، دقيق للغاية، بديع,The artist's exquisite attention to detail made the painting truly remarkable.,False,False,6c8c65dd-9dc2-4c4c-99bf-4691e0002925,"same word+POS, diff Arabic def"
c29319a0-d92d-4332-a007-c4a8bc5dfb11,revelatory,5,7,Neuroscience Frontiers,adjective,كاشف، مُفصح، يكشف الحقائق,The documentary provided revelatory insights into the politician's private life.,False,False,e0177b64-fb9a-4291-b4c9-f3351763e855,"same word+POS, diff Arabic def"
2153c2b8-9bd2-4daf-8696-cb0316ee0ec3,implications,5,7,Neuroscience Frontiers,noun,تداعيات، آثار، نتائج محتملة,The discovery of water on Mars has profound implications for space exploration.,False,False,192e0a47-ad22-441f-869a-b433576d0c6b,"same word+POS, diff Arabic def"
25ab2848-f125-4f7a-8728-f577ecdea44a,neuroplasticity,5,7,Neuroscience Frontiers,noun,المرونة العصبية، قدرة الدماغ على إعادة التنظيم,Research on neuroplasticity has shown that meditation can physically change brain structure.,False,False,9929ef15-3d91-4439-96dd-70fd64e6036f,"same word+POS, diff Arabic def"
70b530c8-4c6a-458b-984d-28e1f7c4e2c1,compelling,5,7,Neuroscience Frontiers,adjective,مقنع، جذاب، مثير للاهتمام بقوة,The evidence for climate change is compelling and cannot be ignored.,False,False,c8a99606-bcaf-4b20-957c-e1ad9c7c4fed,"same word+POS, diff Arabic def"
899995fb-c5f7-4daf-99d4-cd6339a73469,impediments,5,7,Neuroscience Frontiers,noun,عوائق، عقبات، موانع,Language barriers can be significant impediments to international business success.,False,False,1fa03808-7010-45ee-be3d-27090d7f87e4,"same word+POS, diff Arabic def"
a6e7702f-a3e3-4209-84a8-d534c4e83627,vicissitudes,5,7,Neuroscience Frontiers,noun,تقلبات الحياة، التغيرات الطبيعية، المد والجزر في أي عملية,"Despite the vicissitudes of the stock market, long-term investors remained confident.",False,False,15dababe-94b2-4e18-b708-8bc17c444343,"same word+POS, diff Arabic def"
74c70853-5c6e-48dd-aa96-b79abe474aeb,optimize,5,7,Neuroscience Frontiers,verb,يحسّن، يُمثل، يجعل مثالياً,Companies use data analytics to optimize their marketing strategies.,False,False,0e79639d-e73f-4dc1-afac-6bc47115fabf,"same word+POS, diff Arabic def"
9357919f-5793-43ea-bb7f-13e8bd5eea51,watershed,5,7,Neuroscience Frontiers,noun,نقطة تحول، حدث فاصل، منعطف مهم,The invention of the internet was a watershed moment in human communication.,False,False,2b5bb24d-3a72-4bb8-a07a-1f656117e774,"same word+POS, diff Arabic def"
cc0df652-58dd-44b9-9b33-643ba77281d2,confluence,5,7,Neuroscience Frontiers,noun,التقاء، تلاقي، اجتماع عناصر أو أفكار مختلفة,The city's unique culture emerged from a confluence of Eastern and Western influences.,False,False,a64486ee-a074-4f8d-9980-2f65dd7be7ec,"same word+POS, diff Arabic def"
0bcad118-6720-42e7-83bf-67650fa02eb6,permeate,5,8,Swarm Intelligence,verb,ينتشر في، يتخلل، يسري عبر,The smell of fresh bread began to permeate the entire bakery.,False,False,5b44f3a7-52f5-46cd-9670-f2eb903438cc,"same word+POS, diff Arabic def"
8748548a-695d-41f5-a8bd-77d8d8542135,intractable,5,8,Swarm Intelligence,adjective,عصي على الحل، مستعصي، صعب المراس,The company faced an intractable problem with its outdated software system.,False,False,0bd95740-c6fd-4f31-b2ff-745d36e19643,"same word+POS, diff Arabic def"
dea259cb-17ad-4753-a6a1-a3627e859046,compelling,5,8,Swarm Intelligence,adjective,مقنع، جذاب، مثير للاهتمام بقوة,The documentary presented compelling evidence about climate change that changed many viewers' minds.,False,False,55ecbc69-4616-4028-9d10-d63805aaa052,"same word+POS, diff Arabic def"
387fdf21-2473-4597-a055-c7c4698ccf37,compelling,5,8,Swarm Intelligence,adjective,مقنع، جذاب، لافت للنظر,The documentary presented a compelling argument for renewable energy adoption.,False,False,55ecbc69-4616-4028-9d10-d63805aaa052,"same word+POS, diff Arabic def"
0be874a4-ec9a-47a6-a541-3344e199eb17,paradigmatic,5,8,Swarm Intelligence,adjective,نموذجي، مثالي، نمطي,The iPhone was paradigmatic of how smartphones should be designed.,False,False,b964d48b-0c7d-4cae-8f91-5fcb8515836a,"same word+POS, diff Arabic def"
e08d5699-f92e-4027-9632-912583218743,epitomize,5,8,Swarm Intelligence,verb,يجسد، يمثل، يكون مثالاً مثالياً,Her dedication to charity work epitomizes the spirit of community service.,False,False,affdef4c-0f46-418b-b9ce-4e4080c03620,"same word+POS, diff Arabic def"
3a48fb5a-4fab-4d4e-907d-2f277160f5af,quintessential,5,8,Swarm Intelligence,adjective,مثالي، نموذجي، جوهري,"Paris is considered the quintessential romantic city, embodying everything people associate with rom",False,False,912f89ad-a80a-4c02-b8bd-423d866426ac,"same word+POS, diff Arabic def"
a2be2fb8-6481-4ce8-b435-09f3ee75b41f,quintessential,5,8,Swarm Intelligence,adjective,نموذجي، مثالي، جوهري,Paris is considered the quintessential romantic city for many travelers.,False,False,912f89ad-a80a-4c02-b8bd-423d866426ac,"same word+POS, diff Arabic def"
ae65142b-e326-4378-b405-7ad27a0b197d,nexus,5,8,Swarm Intelligence,noun,نقطة الاتصال، المركز، الرابط,The university serves as a nexus between academic research and practical innovation.,False,False,834395ba-b53f-4c69-a502-7be21b7cdbf8,"same word+POS, diff Arabic def"
21c94cc7-be8c-453a-8a74-6d07e7515cc8,confound,5,8,Swarm Intelligence,verb,يحير، يربك، يفند,The magician's tricks continue to confound audiences despite being performed for centuries.,False,False,1fd3fcf7-2111-423e-8663-c6bce4c17a8c,"same word+POS, diff Arabic def"
1b82e039-157c-4637-a640-653129fc6cb2,confound,5,8,Swarm Intelligence,verb,يحير، يربك، يذهل,The magician's trick continued to confound even the most experienced observers.,False,False,1fd3fcf7-2111-423e-8663-c6bce4c17a8c,"same word+POS, diff Arabic def"
78f18b94-a537-4270-8de2-dd4d9ccd7a0c,confound,5,8,Swarm Intelligence,verb,يربك، يحير، يفند,The student's brilliant answer confounded the professor's expectations.,False,False,1fd3fcf7-2111-423e-8663-c6bce4c17a8c,"same word+POS, diff Arabic def"
8124a30e-3389-467c-ab90-6aa27f55123c,emergent,5,8,Swarm Intelligence,adjective,ناشئ، متطور، ظاهر,Artificial intelligence shows emergent behaviors that its programmers never explicitly designed.,False,False,7f99bec1-a34e-4840-a783-b2ded61efb51,"same word+POS, diff Arabic def"
bd84d5a6-7d45-4a0a-9379-b3e3fe522e68,manifestations,5,8,Swarm Intelligence,noun,مظاهر، تجليات، علامات,The protests were manifestations of widespread public dissatisfaction with the policy.,False,False,c3aa85b2-6f9e-49fa-8eb1-b8daeff75a3a,"same word+POS, diff Arabic def"
a0cb4e05-e1cc-4c7d-a12a-ad633b5a1491,conspicuous,5,8,Swarm Intelligence,adjective,واضح، بارز، ملفت للنظر,The mansion's conspicuous display of wealth made neighbors uncomfortable.,False,False,78b28cab-35b5-416d-9c0f-c3a8276fdd7c,"same word+POS, diff Arabic def"
90ac6786-d2b5-4506-b46e-64ed067f2298,orchestrate,5,8,Swarm Intelligence,verb,ينظم، ينسق، يدبر,The marketing team orchestrated a successful product launch campaign.,False,False,ffcadbac-5a3d-419e-873a-14d8c79ece69,"same word+POS, diff Arabic def"
a4bd13ad-43c1-44b2-97c5-614d3314a5a6,efficacious,5,8,Swarm Intelligence,adjective,فعال، مؤثر، ناجع,The new medication proved highly efficacious in treating the disease.,False,False,4ed0abd8-e942-4701-8b02-2bdc10a6413c,"same word+POS, diff Arabic def"
9a3e530b-88ab-41fc-94aa-726df57c8416,ramifications,5,8,Swarm Intelligence,noun,تداعيات، عواقب، نتائج,The policy change had serious ramifications for small businesses.,False,False,3f4caf5b-eea5-4668-9674-99dc011bb9d3,"same word+POS, diff Arabic def"
8eb2ac67-269f-434f-851a-1716673c2fb9,orchestrates,5,8,Swarm Intelligence,verb,ينظم، ينسق، يقود,The project manager orchestrated the collaboration between five different departments.,False,False,1693c2e6-2af4-42ef-b7c1-8e84a6e1057e,"same word+POS, diff Arabic def"
8545687d-eb3e-45c1-9007-5d08afa24ee5,synthesis,5,8,Swarm Intelligence,noun,تركيب، دمج، توليف,The research paper presented a synthesis of various theories on climate change.,False,False,3768bc3c-f18a-4d62-9c09-07440900fd78,"same word+POS, diff Arabic def"
4ed6d905-8f7c-4b10-a8be-2e2159891386,paradigm,5,8,Swarm Intelligence,noun,نموذج، مثال، نمط فكري,Remote work has created a new paradigm for how companies operate globally.,False,False,c35a90fd-896a-45f8-aecc-5a603d6a0b96,"same word+POS, diff Arabic def"
90826e2d-9dea-4cb4-ae97-946c8eea50c1,enigmatic,5,9,Creative Genius,adjective,غامض، محيّر، صعب الفهم أو التفسير,The Mona Lisa's enigmatic smile has captivated viewers for centuries.,False,False,6ce81099-2203-4fe0-89de-6e64fd3cd4ec,"same word+POS, diff Arabic def"
2037820a-f1ed-4893-9680-dafcd9d41d42,momentum,5,9,Creative Genius,noun,زخم، قوة دافعة، استمرارية,The environmental movement gained momentum after the documentary was released.,False,False,78c9d421-caf2-4273-931a-21624af77d86,"same word+POS, diff Arabic def"
a06924ca-af57-48bf-9974-30007e11efdf,orchestration,5,9,Creative Genius,noun,تنسيق، تنظيم دقيق، ترتيب معقد,"The successful event required careful orchestration of logistics, timing, and personnel.",False,False,0778ec90-2db6-4060-afe9-13ab15380525,"same word+POS, diff Arabic def"
4dea1af3-79ac-451b-a0f4-904d893794df,compelling,5,9,Creative Genius,adjective,مقنع، جذاب، لا يقاوم,The lawyer presented a compelling argument that convinced the jury.,False,False,175de3c2-1645-406b-b673-0436b11ef42c,"same word+POS, diff Arabic def"
493a25c3-3752-4776-8dc6-1acdb9d5ac11,foster,5,9,Creative Genius,verb,يشجع، يعزز، ينمي، يرعى,Good teachers foster creativity and critical thinking in their students.,False,False,1e101c04-195c-4215-ab21-8415d7a07dc0,"same word+POS, diff Arabic def"
c7b82d1d-9e3d-41cc-812b-ce6a0d9c5e9f,meander,5,9,Creative Genius,verb,يتجول بلا هدف، ينحني ويلتوي، يسير في مسار متعرج,"We decided to meander through the old city streets, discovering hidden cafes and bookshops.",False,False,545b546b-b51c-4716-8f0b-d8d68a0eaedc,"same word+POS, diff Arabic def"
62d9d7bf-1fa3-4fcd-a967-7e1e5d753471,ambiguity,5,9,Creative Genius,noun,غموض، التباس، عدم وضوح,The contract's ambiguity led to disputes between the two companies.,False,False,985f39cf-da76-4ce9-95c2-24fe08dc3f04,"same word+POS, diff Arabic def"
5ee53707-2395-41cd-a6db-169f7e057db8,spontaneous,5,9,Creative Genius,adjective,تلقائي، عفوي، فوري,The crowd broke into spontaneous applause when the musician finished his performance.,False,False,7443a044-0bc1-4960-89a8-e4b3bb8c142d,"same word+POS, diff Arabic def"
265ab789-7d20-4675-94ff-b2922f6403f5,correlation,5,9,Creative Genius,noun,ترابط، علاقة، صلة متبادلة,Scientists discovered a strong correlation between exercise and improved mental health.,False,False,f88b432d-96a9-4b9f-a544-914f91c92e6c,"same word+POS, diff Arabic def"
0032fe6b-2195-451f-b8a3-24ae4c99ee07,incorporate,5,9,Creative Genius,verb,يدمج، يضمّن، يشمل,The architect decided to incorporate sustainable materials into the building design.,False,False,614137f9-415d-48ce-a46b-5ef4be174fc6,"same word+POS, diff Arabic def"
a29183bb-e353-4783-adf8-7668d8185de7,catalyze,5,9,Creative Genius,verb,يحفز، يسرع، يثير,The new government policies helped catalyze economic growth in the region.,False,False,75bb8683-cb94-4782-ae32-bf41b9ef10a0,"same word+POS, diff Arabic def"
eeeaa9ca-3c19-453b-9eee-0941781abd70,manifestation,5,9,Creative Genius,noun,تجلّي، مظهر، إظهار,His charitable work was a manifestation of his deep commitment to social justice.,False,False,b1343367-8109-4b1a-86d2-27969d985e7b,"same word+POS, diff Arabic def"
b6925141-0e80-4f0a-9f72-852eaa9fb981,confluence,5,9,Creative Genius,noun,تقاء، تلاقي، نقطة الالتقاء، انصباب,"The city developed at the confluence of three major rivers, making it a natural trading center.",False,False,aacce3c0-45e6-432b-8471-dbb2d9f06704,"same word+POS, diff Arabic def"
34d0931c-f97a-47b3-916a-bc94bca06f9a,amplify,5,9,Creative Genius,verb,يضخم، يكبر، يعزز، يقوي,Social media can amplify both positive messages and harmful misinformation.,False,False,635fdce0-b4e3-4495-a16b-0e3a2e90866b,"same word+POS, diff Arabic def"
d6f34724-10a0-47f8-977c-0a3eaf123500,valorize,5,9,Creative Genius,verb,يقدّر، يثمّن، يعطي قيمة,The museum exhibition sought to valorize the contributions of women scientists.,False,False,a081fae2-e350-4786-a510-676a356c6eae,"same word+POS, diff Arabic def"
6ccc90a0-6a7c-466b-8970-7ffa64f7396c,profound,5,9,Creative Genius,adjective,عميق، بالغ، شديد التأثير، جوهري,The loss of his mentor had a profound impact on the young scientist's career direction.,False,False,4a0d4426-1514-4564-b026-3a4495787e67,"same word+POS, diff Arabic def"
d2c6168f-9eda-4d82-89cd-3d7a756af0e9,incubation,5,9,Creative Genius,noun,حضانة، تطوير، فترة نضج,The startup spent six months in incubation before launching their product.,False,False,acbec3ed-55c4-44de-8c8f-d5ebe0a52072,"same word+POS, diff Arabic def"
19da4287-7cfe-4bb1-832e-83633239d875,enigmatic,5,10,Quantum Discovery,adjective,غامض، محير، لغز,The professor's enigmatic smile left students wondering whether they had answered correctly.,False,False,807535b9-e46e-49bd-b9a0-55a147ca46d1,"same word+POS, diff Arabic def"
1977d8ce-0212-45ac-8e4e-10b84f4552a1,paradigm,5,10,Quantum Discovery,noun,نموذج، نمط، إطار مفاهيمي,The introduction of smartphones created a new paradigm for mobile communication.,False,False,c8b2346a-9092-4a6b-9dc9-1e5c0f693e75,"same word+POS, diff Arabic def"
7d2d351e-cc42-45bf-a593-a9399cb00f51,paradigm,5,10,Quantum Discovery,noun,نموذج، نمط، إطار فكري,The internet created a new paradigm for how we access and share information.,False,False,c8b2346a-9092-4a6b-9dc9-1e5c0f693e75,"same word+POS, diff Arabic def"
367ff4fe-5f40-4e0d-a71d-30b591f3608c,paradigm,5,10,Quantum Discovery,noun,نموذج، نمط، إطار مفاهيمي,The discovery of DNA changed the entire paradigm of biological research.,False,False,c8b2346a-9092-4a6b-9dc9-1e5c0f693e75,"same word+POS, diff Arabic def"
974f9f18-ca56-42b6-8e2a-1fcf5901902e,esoteric,5,10,Quantum Discovery,adjective,غامض، معقد، مخصص للخبراء,The philosopher's esoteric theories were difficult for undergraduate students to grasp.,False,False,366aeedc-c16d-462d-bd52-b8e104f47ce6,"same word+POS, diff Arabic def"
866bc223-2be6-4702-8ad5-87d5841a3df6,contravene,5,10,Quantum Discovery,verb,يخالف، يعارض، يناقض,The new policy appears to contravene international human rights agreements.,False,False,190337f8-5147-4bbe-a25e-3d6d4274465a,"same word+POS, diff Arabic def"
822a9d68-e42d-4269-bafe-ee855a1edbc9,precipitate,5,10,Quantum Discovery,verb,يستعجل، يسبب، يؤدي إلى,The economic crisis could precipitate major changes in government policy.,False,False,a4382254-cb28-4f01-b7f3-c1c7d7a151d1,"same word+POS, diff Arabic def"
66b1ee20-5091-497c-bc3d-f38835973402,profound,5,10,Quantum Discovery,adjective,عميق، جذري، بالغ التأثير,The philosopher's profound insights changed how we think about human nature.,False,False,dc67b4c7-f21c-4b28-b059-198cff06188d,"same word+POS, diff Arabic def"
b0168e6f-8962-4c4d-8dda-e88734a56ed9,coherence,5,10,Quantum Discovery,noun,تماسك، ترابط، انسجام,"The essay lacked coherence, jumping from one topic to another without clear connections.",False,False,3d4fb26d-1171-41c2-adca-31a2e6c7f71b,"same word+POS, diff Arabic def"
3325178f-bedf-4a99-88e9-2c238653242b,coherence,5,10,Quantum Discovery,noun,تماسك، انسجام، ترابط,"The essay lacked coherence, jumping from topic to topic without clear connections.",False,False,3d4fb26d-1171-41c2-adca-31a2e6c7f71b,"same word+POS, diff Arabic def"
6fd579cf-5725-4f3c-a49a-1afac5b690db,encompassing,5,10,Quantum Discovery,adjective,شامل، يغطي كل شيء,The university offers an encompassing curriculum that covers both theoretical and practical aspects.,False,False,5eb1503d-4b13-462f-95f4-2b88c5f1f527,"same word+POS, diff Arabic def"
18da8f7a-53e1-4db9-a636-b1313ef0ad87,capricious,5,10,Quantum Discovery,adjective,متقلب، متذبذب، غير متوقع,The capricious weather made it difficult to plan outdoor activities for the week.,False,False,8ee757ff-7484-449d-9f9a-20dd91b3ff41,"same word+POS, diff Arabic def"
e8271040-e181-4316-9960-7fec0fcb4960,surmount,5,10,Quantum Discovery,verb,يتغلب على، يتخطى، يقهر,"Despite financial difficulties, she managed to surmount all obstacles and complete her education.",False,False,5b607543-9ace-44bc-bfdb-7b1ae378fb79,"same word+POS, diff Arabic def"
3944c73f-9670-4e67-8bc7-891fd118caf8,decipher,5,10,Quantum Discovery,verb,يفك الشفرة، يحل الرموز، يفسر,Archaeologists worked for years to decipher the ancient hieroglyphics.,False,False,d7bd3abe-aebc-45a4-acaa-c9a88277ed11,"same word+POS, diff Arabic def"
28d0b148-5f40-4311-9548-a8ff7f5dd62c,convergence,5,10,Quantum Discovery,noun,تقارب، تلاقي، اندماج,The convergence of technology and medicine has created new treatment possibilities.,False,False,0e2c702f-74c6-4ed8-b5d6-c7ecb6a31b70,"same word+POS, diff Arabic def"
b9474795-1289-4ee8-968f-fc3ca7a8c172,galvanized,5,10,Quantum Discovery,verb,حفّز، نشّط، حرّك للعمل,The environmental crisis galvanized young activists to organize climate protests worldwide.,False,False,f6fee3af-34b6-4e42-a60d-30e98cb2a5e8,"same word+POS, diff Arabic def"
58ad2045-e378-4b7a-84aa-c95f15fe44df,galvanized,5,10,Quantum Discovery,verb,يحفز، ينشط، يدفع للعمل,The environmental crisis galvanized young activists to organize worldwide protests.,False,False,f6fee3af-34b6-4e42-a60d-30e98cb2a5e8,"same word+POS, diff Arabic def"
ec11a5e0-11a0-4518-a492-73f4dff89851,heterogeneity,5,10,Quantum Discovery,noun,عدم التجانس، التنوع، الاختلاف,The heterogeneity of the student population enriched classroom discussions.,False,False,a2ebd667-78c0-4519-914a-6fa2626d306f,"same word+POS, diff Arabic def"
7ca07337-e98a-4032-b7f0-fae2ee08b14e,proliferate,5,10,Quantum Discovery,verb,ينتشر بسرعة، يتكاثر، يزداد,Social media platforms have proliferated dramatically over the past decade.,False,False,febeea1f-5796-4526-ae1a-1e92788992d3,"same word+POS, diff Arabic def"
17953201-fc12-4088-8c44-347c193a126a,paradigm,5,11,Cross-Cultural Exchange,noun,نموذج أو نمط؛ إطار فكري أو مفاهيمي,The company adopted a new paradigm for remote work that prioritized results over hours worked.,False,False,cfe3b5db-1a27-481c-a621-798db21ba296,"same word+POS, diff Arabic def"
97aa5ca6-6f26-40ac-87f2-10a88bcd3083,paradigmatic,5,11,Cross-Cultural Exchange,adjective,نموذجي، يمثل مثالاً أو نموذجاً مميزاً لشيء ما,The company's approach to employee wellness has become paradigmatic for the entire industry.,False,False,c173e6c6-2b4b-497a-9057-3a2b312db58f,"same word+POS, diff Arabic def"
93e05d1e-b729-4188-a9d1-4dd285807f79,paradigmatic,5,11,Cross-Cultural Exchange,adjective,نموذجي؛ يشكل مثالاً مثالياً,The case study became paradigmatic of successful urban renewal projects.,False,False,c173e6c6-2b4b-497a-9057-3a2b312db58f,"same word+POS, diff Arabic def"
c2e81591-52c0-4922-a061-f4bca13edc0c,salient,5,11,Cross-Cultural Exchange,adjective,بارز أو مهم؛ ملفت للانتباه,The report highlighted the salient features of the new educational policy.,False,False,34429080-5765-45e1-8b93-c7abc4bd1f89,"same word+POS, diff Arabic def"
e1e3326c-59cb-48f9-9c78-4d497fb580f3,proliferation,5,11,Cross-Cultural Exchange,noun,انتشار، تكاثر، ازدياد سريع,The proliferation of social media platforms has changed the way people share information.,False,False,ad60c3ab-398f-4c2f-96d6-34aeb4dc2ed2,"same word+POS, diff Arabic def"
64bfdcc3-a1f1-4586-a953-496dc02abaef,nuanced,5,11,Cross-Cultural Exchange,adjective,دقيق؛ يحتوي على فروقات دقيقة ومعقدة,The diplomat's nuanced understanding of the situation helped avoid conflict.,False,False,88cdf48c-5c79-494c-a682-647e829593a9,"same word+POS, diff Arabic def"
8a4a51a2-6840-4037-b17e-fe862fb71ede,obviate,5,11,Cross-Cultural Exchange,verb,يلغي الحاجة إلى؛ يجعل غير ضروري,The new software will obviate the need for manual data entry.,False,False,90a8672f-ac14-4492-a287-d7934946e5c0,"same word+POS, diff Arabic def"
658f3107-0e0f-4a49-9f2d-c80d952b1230,symbiotic,5,11,Cross-Cultural Exchange,adjective,تكافلي، تبادلي المنفعة، متفاعل,"The university has a symbiotic relationship with local businesses, providing research while receivin",False,False,e0d49cba-b6b2-4899-8436-dc7382a54838,"same word+POS, diff Arabic def"
52cec276-7976-445a-b95d-48d6fb5db27a,transcend,5,11,Cross-Cultural Exchange,verb,يتجاوز، يتخطى، يسمو فوق,Great art has the power to transcend cultural and linguistic barriers.,False,False,f304afc9-d3bb-4a76-9524-0ebca426bd1b,"same word+POS, diff Arabic def"
fb780c9c-c12a-41a2-9160-776e2c3846bb,reciprocity,5,11,Cross-Cultural Exchange,noun,التبادل المتكافئ؛ المعاملة بالمثل,The trade agreement was based on principles of reciprocity between the two nations.,False,False,9c0d3556-7100-4303-b32a-6e6ee4c9e82e,"same word+POS, diff Arabic def"
fe265245-3be9-4d5c-9fee-115c1ab5fe7c,contentious,5,11,Cross-Cultural Exchange,adjective,مثير للجدل، خلافي، مختلف عليه,The proposal to build a new airport remains a contentious issue among city residents.,False,False,0868747d-8a6a-472f-83fe-1e0a10788e70,"same word+POS, diff Arabic def"
de9b7e8e-a6ad-4325-8b75-958df75ab73f,stringent,5,11,Cross-Cultural Exchange,adjective,صارم، شديد، متشدد,The hospital implemented stringent safety protocols after the outbreak.,False,False,d71774b7-c8fd-46a0-b909-62b9a0073b09,"same word+POS, diff Arabic def"
6fdb24b4-a1e5-4ae5-8380-2519eacb5c78,compelling,5,11,Cross-Cultural Exchange,adjective,مقنع؛ مثير للاهتمام بقوة,She made a compelling argument for increasing investment in renewable energy.,False,False,30310297-c088-4e69-8b4f-8743a67bb5f9,"same word+POS, diff Arabic def"
fe2d719f-f3ed-41aa-947c-542893878b8f,dispel,5,11,Cross-Cultural Exchange,verb,يبدد؛ يزيل الشكوك أو المعتقدات الخاطئة,The manager held a meeting to dispel rumors about potential layoffs.,False,False,b090c853-54a6-4995-bbd4-dcf3023d588a,"same word+POS, diff Arabic def"
388a87f9-6e1b-4982-9196-8ca0991e24ac,dichotomy,5,11,Cross-Cultural Exchange,noun,انقسام ثنائي، تضاد، ازدواجية,There's often a false dichotomy between economic growth and environmental protection.,False,False,7d618d50-0ed5-421d-ab2a-f255bd0288a9,"same word+POS, diff Arabic def"
4e7cdff2-c301-4218-9e58-eaf5dc50fef3,ethnocentric,5,11,Cross-Cultural Exchange,adjective,متمركز حول العرق، متحيز ثقافياً، عنصري ثقافياً,An ethnocentric approach to international business often leads to misunderstandings and failed partn,False,False,019f6ce5-4c74-47e5-914f-246669be7a16,"same word+POS, diff Arabic def"
0ff60879-a806-4d0c-a397-a4ea079a6d37,osmosis,5,11,Cross-Cultural Exchange,noun,الامتصاص التدريجي؛ التشرب,"Children learn their native language through osmosis, absorbing grammar rules without formal instruc",False,False,46c90b36-fcb7-4d6d-afac-c38a8b3467fd,"same word+POS, diff Arabic def"
5daca319-36ca-4111-88d5-195b8ccf339e,ramifications,5,11,Cross-Cultural Exchange,noun,تبعات، عواقب، نتائج معقدة,The government failed to consider the long-term ramifications of the new tax policy.,False,False,1ee26197-6b72-4718-bd21-07bb1b5d78dc,"same word+POS, diff Arabic def"
e845f518-5520-40b6-9056-37ea62a19be1,permeate,5,11,Cross-Cultural Exchange,verb,ينتشر في؛ يتخلل كل جزء,The smell of fresh coffee permeated the entire office building.,False,False,73d4ba52-7464-49f5-82fc-a5a6dcb4b449,"same word+POS, diff Arabic def"
8cc09821-2d72-4e6c-a679-eb66590c467f,vanguard,5,11,Cross-Cultural Exchange,noun,طليعة، مقدمة، رواد,The research team is at the vanguard of artificial intelligence development.,False,False,604dc724-91c9-4548-90c5-264849ef6ba3,"same word+POS, diff Arabic def"
43a957d8-ae07-4158-a410-123d57253096,replicate,5,11,Cross-Cultural Exchange,verb,يكرر؛ ينسخ أو يعيد إنتاج,Scientists were unable to replicate the results of the original experiment.,False,False,ea9a9637-f5bb-4b5a-8cb0-3af7d6c5a8cd,"same word+POS, diff Arabic def"
e60c6859-b75d-40b8-bc27-12e48ec9a21d,implications,5,11,Cross-Cultural Exchange,noun,تداعيات؛ نتائج أو آثار محتملة,The CEO failed to consider the long-term implications of the merger.,False,False,196fc8df-4265-499d-bd3e-3ef081553a56,"same word+POS, diff Arabic def"
