vocab_id,word,level,unit_number,unit_title,part_of_speech,definition_ar,example_en,has_audio,has_image,keep_id,reason
dbef5c01-8e3e-4bc9-bf11-374ef583587e,unprecedented,4,9,Archaeological Mysteries,adjective,غير مسبوق، لم يحدث من قبل، بلا مثيل سابق,The company achieved unprecedented profits this year.,False,False,bd395eea-5a18-479f-b273-c33a2d3c195c,"same word+POS, diff Arabic def"
bf76372b-f666-4c70-a7fa-76d2779e8c51,tangible,4,9,Archaeological Mysteries,adjective,ملموس، محسوس، واقعي,The new policy has produced tangible improvements in student performance.,False,False,25c2cd7a-7851-479a-b554-04147ce350bf,"same word+POS, diff Arabic def"
36bed955-7718-46f2-a413-27d2c8b2fb6b,implications,4,9,Archaeological Mysteries,noun,تداعيات، آثار، عواقب,The new law will have serious implications for small business owners.,False,False,59c39744-b105-45cc-8a39-deeb761c0c18,"same word+POS, diff Arabic def"
95dc6f6b-8016-44ff-b093-4087a03f0be1,implications,4,9,Archaeological Mysteries,noun,تداعيات، عواقب، آثار,The new policy has serious implications for small business owners.,False,False,59c39744-b105-45cc-8a39-deeb761c0c18,"same word+POS, diff Arabic def"
9f4fc8a0-d4c1-4ae7-a378-97efd43551bc,implications,4,9,Archaeological Mysteries,noun,التداعيات، النتائج المحتملة، أو المعاني المترتبة على عمل أو قرار,The new law has serious implications for small businesses.,False,False,59c39744-b105-45cc-8a39-deeb761c0c18,"same word+POS, diff Arabic def"
7b59aa2d-1f37-488c-9d09-2816f0cf2628,sophistication,4,9,Archaeological Mysteries,noun,التطور، التعقيد، أو الرقي في التطوير والتقدم,The sophistication of modern computers amazes older generations.,False,False,77378d59-8d7a-46d2-854e-46d448eef396,"same word+POS, diff Arabic def"
a5351276-ecfa-4ba9-b107-2a2d4e4cba2e,preservation,4,9,Archaeological Mysteries,noun,حفظ، صيانة، المحافظة على شيء من التلف,The preservation of historical buildings is important for future generations.,False,False,78cb76b8-9111-43e7-a60f-9cb264ac3f7a,"same word+POS, diff Arabic def"
be25cc94-023b-43b6-b5e2-792e16e78dad,bottleneck,4,9,Archaeological Mysteries,noun,عنق زجاجة، اختناق، عائق,Traffic creates a bottleneck on the highway during rush hour.,False,False,c2eda0e7-0cc1-4d75-a534-017c4846a4b7,"same word+POS, diff Arabic def"
8ec58d27-15e9-48f0-95a3-7cce535f1034,resilience,4,9,Archaeological Mysteries,noun,مرونة، قدرة على التأقلم، صمود,The community showed remarkable resilience after the natural disaster.,False,False,7db35ba4-697b-4126-be6b-77583c0de0ee,"same word+POS, diff Arabic def"
d4469335-8c1d-44c7-b6ef-22e55faf145a,overshadow,4,9,Archaeological Mysteries,verb,يطغى على، يحجب أهمية شيء آخر بكونه أكثر بروزاً أو أهمية,His mistakes overshadowed all the good work he had done previously.,False,False,8893a129-0ab7-4623-9de5-356847dd2826,"same word+POS, diff Arabic def"
c554fe62-7848-41c7-88d3-d51847f3c326,trajectory,4,9,Archaeological Mysteries,noun,المسار، الاتجاه، أو مسيرة التطور والتقدم عبر الزمن,The company's trajectory shows steady growth over the past five years.,False,False,5dcd45c5-fd84-41fa-9c4e-a8061ae7e2f5,"same word+POS, diff Arabic def"
bc26497f-857c-4942-8b0f-cba9cd50bb03,devastate,4,9,Archaeological Mysteries,verb,يدمر، يخرب، يهلك,"The hurricane devastated the coastal towns, leaving thousands homeless.",False,False,c55dd03b-4990-46aa-896e-c7c9ede6c1c7,"same word+POS, diff Arabic def"
f21f3f9d-706b-4520-8704-34808a9d4849,breakthroughs,4,10,Longevity Science,noun,اختراقات علمية، اكتشافات مهمة,Medical breakthroughs in cancer treatment have saved millions of lives.,False,False,ac56a099-0866-46c1-9b62-c622a8784192,"same word+POS, diff Arabic def"
e4cb6648-dc55-4710-b5df-852caddc19ed,breakthrough,4,10,Longevity Science,noun,إنجاز مهم، اختراق، اكتشاف جديد,Scientists announced a major breakthrough in cancer treatment research.,False,False,d1a3a89a-febb-4119-8a6e-717094d35b46,"same word+POS, diff Arabic def"
0b576983-6224-46f7-b226-8c847b1f1baa,manifest,4,10,Longevity Science,verb,يُظهر، يتجلى، يُبدي,The effects of climate change manifest in rising sea levels and extreme weather.,False,False,1dedc9c2-4425-4c83-a5fc-10f66d833129,"same word+POS, diff Arabic def"
f6fd4704-a82e-4b5b-aaf6-2886371824a0,scrutinize,4,10,Longevity Science,verb,يفحص بدقة، يتمعن، يدرس بعناية,The auditors will scrutinize all financial records before approving the budget.,False,False,a0f3b30b-2f97-4c6d-a811-23410993c89f,"same word+POS, diff Arabic def"
771d0262-d3a0-4578-98c4-d63366b1137e,paradigm,4,10,Longevity Science,noun,نموذج فكري، نمط، مفهوم أساسي,The traditional paradigm of education is changing with online learning.,False,False,180faf58-b3f1-449b-8379-51835cde5094,"same word+POS, diff Arabic def"
9ed6be48-cce5-4bc8-9f51-84733c55cecf,underlying,4,10,Longevity Science,adjective,أساسي، كامن، جوهري,The underlying cause of the conflict was economic inequality.,False,False,f4548044-611b-46af-890c-71b517238689,"same word+POS, diff Arabic def"
61f1cf13-0b9a-42ec-ba3c-c04d26cde2e2,correlate,4,10,Longevity Science,verb,يرتبط، يتناسب، له علاقة,Studies show that exercise levels correlate with improved mental health.,False,False,4e618e91-01ec-4fe4-a660-c38e07643876,"same word+POS, diff Arabic def"
9906089d-850e-46f6-b53d-86de81d77c91,implications,4,10,Longevity Science,noun,تداعيات، آثار، نتائج محتملة,The implications of climate change affect every country on Earth.,False,False,a9425287-7605-4dda-92c0-8cd6189cec6f,"same word+POS, diff Arabic def"
49e5972e-597c-4485-80b1-a2767ed5f31a,cognitive,4,10,Longevity Science,adjective,معرفي، إدراكي، متعلق بالتفكير,Regular reading helps maintain cognitive function as we age.,False,False,ab281dd4-48bf-443c-9661-c51d67fd9f90,"same word+POS, diff Arabic def"
14e21d0a-490c-4a97-80e9-b2a46c1183c3,mitigate,4,10,Longevity Science,verb,يخفف، يقلل، يهون,New flood barriers were built to mitigate the risk of future disasters.,False,False,ca349cfb-08aa-4e19-bb34-8c1718ceb1b7,"same word+POS, diff Arabic def"
926dd27f-d46c-4faa-9b76-434b98e53729,reciprocal,4,10,Longevity Science,adjective,متبادل، متقابل، تفاعلي,Good friendships are built on reciprocal trust and respect.,False,False,31b97a7d-1757-4f0f-9dc6-4d2448fd60fc,"same word+POS, diff Arabic def"
a4c72e99-5093-471e-be28-38b2e266e21d,stimulate,4,10,Longevity Science,verb,ينشط، يحفز، يثير,Coffee can stimulate the nervous system and increase alertness.,False,False,8c8eda86-94b9-4827-8738-ed767f0e01c9,"same word+POS, diff Arabic def"
e9109109-242e-44dd-9637-55b1133b0a60,correlation,4,10,Longevity Science,noun,ارتباط، علاقة، صلة متبادلة,There is a strong correlation between education levels and income.,False,False,f562f740-4241-4c97-b77e-5290d2522baf,"same word+POS, diff Arabic def"
57c8fe88-5582-43b4-ba50-9e927a2a7cee,methodology,4,10,Longevity Science,noun,منهجية، طريقة بحثية منظمة,The research team developed a new methodology for testing the drug.,False,False,a46f9e67-0f1b-43fa-8663-506b5feb8805,"same word+POS, diff Arabic def"
33e7da5c-f128-4c91-862f-7965c0118b8e,optimization,4,10,Longevity Science,noun,تحسين، تطوير، تعظيم الفائدة,The optimization of the website improved its loading speed significantly.,False,False,b4239918-8685-428e-8261-5b30bf7deeaa,"same word+POS, diff Arabic def"
76a7430c-51c5-45a3-887a-d803814106df,intricate,4,10,Longevity Science,adjective,معقد، مفصل، متداخل,The artist spent months creating the intricate patterns on the temple walls.,False,False,1e2d5883-0819-474c-af19-80df8dd914f1,"same word+POS, diff Arabic def"
517b178a-d1c7-480f-9cbc-3a21ac5353a6,comprehensive,4,11,Sustainable Architecture,adjective,شامل، متكامل، جامع,The company needs a comprehensive training program for all new employees.,False,False,7301b428-520f-4637-91fc-9b5f7422dd4c,"same word+POS, diff Arabic def"
557c0369-2265-48bf-8e55-1e0f916dc712,paradigm,4,11,Sustainable Architecture,noun,نموذج، نمط، طريقة تفكير,The internet created a new paradigm for how people communicate and share information.,False,False,2c78ff2d-861d-4658-9d42-ed6820daa200,"same word+POS, diff Arabic def"
e962676d-d104-4710-8b9e-98300742f88f,paradigm,4,11,Sustainable Architecture,noun,نموذج، نمط، إطار نظري,The internet created a new paradigm for how people communicate and share information.,False,False,2c78ff2d-861d-4658-9d42-ed6820daa200,"same word+POS, diff Arabic def"
318d8726-94ea-4a82-a38d-217ad9c538b3,paradigm,4,11,Sustainable Architecture,noun,نموذج، مثال، إطار مرجعي,Online learning has created a new paradigm in education.,False,False,2c78ff2d-861d-4658-9d42-ed6820daa200,"same word+POS, diff Arabic def"
e94b1a4b-5ff0-47ea-b6b0-0feaa993ede2,intricate,4,11,Sustainable Architecture,adjective,معقد، مفصل، دقيق,The watch mechanism was so intricate that only an expert could repair it.,False,False,9695f762-14b2-4b97-b21e-127a71f2c357,"same word+POS, diff Arabic def"
366a6ff4-565b-445b-ba32-023961aed179,momentum,4,11,Sustainable Architecture,noun,زخم، قوة دافعة، دفع,The environmental movement gained momentum after the climate summit.,False,False,d549ddf7-331e-4f04-94da-811a9d3aa1ae,"same word+POS, diff Arabic def"
f398d402-9f44-4b75-a9fe-29042b7192ea,constitute,4,11,Sustainable Architecture,verb,يشكل، يكون، يؤلف,International students constitute about 20% of the university's population.,False,False,492b1ea9-bbed-4a19-9a26-b7acad316266,"same word+POS, diff Arabic def"
152744c6-40aa-43ce-949f-35105d23f74b,authenticity,4,11,Sustainable Architecture,noun,أصالة، صحة، حقيقة,Tourists value the authenticity of traditional crafts made by local artisans.,False,False,d9844241-6c35-4391-a936-624e149166bf,"same word+POS, diff Arabic def"
b3bdaa95-12d9-4e83-ba42-ce738a4d961e,incorporate,4,11,Sustainable Architecture,verb,يدمج، يدرج، يضم,The new curriculum incorporates practical skills alongside theoretical knowledge.,False,False,edcfe77a-5322-417f-96b9-8d2e1c1c5021,"same word+POS, diff Arabic def"
01f12741-eb54-4ca5-86f5-ee953dca0960,scrutinize,4,11,Sustainable Architecture,verb,يفحص بدقة، يدقق، يتمحص,The committee will scrutinize all applications before making their final decision.,False,False,64467606-0c59-4964-89ce-425a86a16b3d,"same word+POS, diff Arabic def"
fe7c40e6-649e-4d0c-838f-21764a2ca45a,implementation,4,11,Sustainable Architecture,noun,التنفيذ، التطبيق، التطبيق العملي,The implementation of the new software system will take three months to complete.,False,False,ac0b53f0-d901-4384-b3e9-4f61561116d6,"same word+POS, diff Arabic def"
77de6a69-60c6-42f4-9e6e-79b4caf962b7,exhaustive,4,11,Sustainable Architecture,adjective,شامل، مستفيض، مفصل,The detective conducted an exhaustive investigation of the crime scene.,False,False,e234d3b0-9f09-42a1-9737-ac00a55f60ec,"same word+POS, diff Arabic def"
fdcabf84-b729-428c-a58b-1f59ac22d82f,framework,4,11,Sustainable Architecture,noun,إطار، هيكل، نظام أساسي,The government established a legal framework to protect consumer rights.,False,False,c1969b0b-1200-4372-b002-aa6d573d00d3,"same word+POS, diff Arabic def"
857a3550-5d3d-4f0e-943f-e72db9c4008e,facilitate,4,11,Sustainable Architecture,verb,يسهل، ييسر، يساعد على,New technology will facilitate communication between remote team members.,False,False,cbe781ef-96c1-4b5f-ae37-632d5dd69ea4,"same word+POS, diff Arabic def"
02de4a42-2d35-459d-a669-545709e5f02d,proliferation,4,11,Sustainable Architecture,noun,انتشار، تكاثر، تزايد,The proliferation of smartphones has changed how people communicate.,False,False,c56bf989-e3a5-4897-959c-284defa622a9,"same word+POS, diff Arabic def"
3095887c-b099-4e3c-aa63-ef70bf66a104,holistic,4,11,Sustainable Architecture,adjective,شمولي، كلي، متكامل,"The doctor takes a holistic approach to treatment, considering both physical and mental health.",False,False,ffcac931-7095-45fc-889e-6e73af5de7f1,"same word+POS, diff Arabic def"
aaca8fb4-9781-415b-b636-9a7254ccf725,fundamental,4,11,Sustainable Architecture,adjective,أساسي، جوهري، مبدئي,Learning grammar is fundamental to mastering any foreign language.,False,False,8100db0e-fd45-4a26-b07f-9449b2b8f740,"same word+POS, diff Arabic def"
fa96b487-08f8-4efb-8958-7477aa10fbae,meticulous,4,12,Exoplanet Hunting,adjective,دقيق جداً، متأنٍ، يولي اهتماماً بالتفاصيل,She did meticulous research before writing her report.,False,False,e11a8aa5-d8e2-430c-9b7c-24b7b015dac1,"same word+POS, diff Arabic def"
6b8dfb57-1e1c-44fa-95f8-95fcdb7b99fa,endeavor,4,12,Exoplanet Hunting,noun,مسعى، جهد، محاولة,Starting her own business was a challenging endeavor that required years of planning.,False,False,e7f28145-1925-48ee-a761-20edc5a91826,"same word+POS, diff Arabic def"
7f0c0e59-9fe7-4b45-934c-95edc380c5fa,scrutinize,4,12,Exoplanet Hunting,verb,يفحص بعناية، يدقق النظر في، يتمعن,The committee will scrutinize all applications before making a decision.,False,False,da2de00d-4106-454a-9921-aa82f758c594,"same word+POS, diff Arabic def"
ab33c57a-b5f4-4178-a35f-e326b1b986e0,intricate,4,12,Exoplanet Hunting,adjective,معقد، متشابك، دقيق التفاصيل,The intricate design of the cathedral took decades to complete.,False,False,ba19b4aa-5bb3-4a6e-b99c-3dd3b9d70412,"same word+POS, diff Arabic def"
85092d01-6e6c-4c96-a52a-c238b62dff42,preconceptions,4,12,Exoplanet Hunting,noun,أفكار مسبقة، تصورات مسبقة، أحكام مُسبقة,Try to approach the problem without any preconceptions about the solution.,False,False,d6d9a76b-6198-4eaf-bc71-14d76fd69086,"same word+POS, diff Arabic def"
c18ef3dd-3cf8-4e58-ba92-f972c0aa0dae,compelling,4,12,Exoplanet Hunting,adjective,مقنع، جذاب، آسر,The documentary presented compelling evidence about climate change.,False,False,c8b9b45e-1e03-4d39-b203-83e9590d3831,"same word+POS, diff Arabic def"
9aa8eaac-cb99-4608-b661-912c5aab8c05,methodology,4,12,Exoplanet Hunting,noun,منهجية، أسلوب، طريقة علمية,The researcher explained her methodology for collecting and analyzing survey data.,False,False,8f72b084-37e5-4d5a-92bc-af673e051a95,"same word+POS, diff Arabic def"
712f6102-ba00-428f-bc28-a192905a9e4e,magnitude,4,12,Exoplanet Hunting,noun,حجم، مقدار، أهمية، عظمة,The magnitude of the earthquake was 7.2 on the Richter scale.,False,False,7d3362d0-1b11-4bda-b503-69571aa82a5c,"same word+POS, diff Arabic def"
21911b6d-7a2d-403c-9de0-70150362a79d,prevalent,4,12,Exoplanet Hunting,adjective,سائد، منتشر، شائع,Smartphone usage is prevalent among teenagers today.,False,False,e6462e06-ba76-434f-9687-0e8e6521cd6f,"same word+POS, diff Arabic def"
23a6efa6-10a5-46a8-94cc-e9102d327886,implications,4,12,Exoplanet Hunting,noun,تداعيات، آثار، دلالات,The new policy changes have serious implications for small businesses.,False,False,093f2ee1-c951-4f06-a1aa-fa069933d37e,"same word+POS, diff Arabic def"
cfba3a92-1e6a-4ed0-83e3-c6e5f25e01b9,implications,4,12,Exoplanet Hunting,noun,تداعيات، آثار، نتائج محتملة,The new policy has serious implications for small business owners.,False,False,093f2ee1-c951-4f06-a1aa-fa069933d37e,"same word+POS, diff Arabic def"
e8d4fc1e-af90-4e6c-9af9-8d723980dad4,ramifications,4,12,Exoplanet Hunting,noun,تبعات، عواقب، آثار معقدة,The ramifications of climate change affect every aspect of our lives.,False,False,7db89bd4-9037-4f62-a83a-12057c3ed1f7,"same word+POS, diff Arabic def"
113f2f6f-8192-44cd-954a-0bf6d3e8e713,ramifications,4,12,Exoplanet Hunting,noun,تداعيات، عواقب، تأثيرات,The ramifications of the new policy will affect millions of workers.,False,False,7db89bd4-9037-4f62-a83a-12057c3ed1f7,"same word+POS, diff Arabic def"
7be1f3c5-51f9-4df6-bfb0-9387f335ecac,unprecedented,4,12,Exoplanet Hunting,adjective,غير مسبوق، لم يحدث من قبل، فريد,The flooding caused unprecedented damage to the coastal region.,False,False,8d7f390e-114b-4929-9fd5-f215fa56ad52,"same word+POS, diff Arabic def"
47b64d5f-6dc9-4ce9-9932-3f62156c6e80,reconceptualize,4,12,Exoplanet Hunting,verb,إعادة تصور، إعادة وضع مفهوم جديد,The company had to reconceptualize its marketing strategy to appeal to younger customers.,False,False,890074b9-4d51-4947-8b28-7298309b5a60,"same word+POS, diff Arabic def"
224afb29-cfbb-4127-b14c-0c0e11496b57,paradigm,4,12,Exoplanet Hunting,noun,نموذج، مثال نمطي، إطار فكري,Online learning has created a new paradigm in education.,False,False,388a3b0c-16fe-46fb-a342-30cf5b854742,"same word+POS, diff Arabic def"
36c42d22-ad5c-473c-8dd1-93e4244d5e39,revolutionize,4,12,Exoplanet Hunting,verb,إحداث ثورة في، تغيير جذري,The internet revolutionized the way people communicate and access information.,False,False,161ab298-98ee-4170-bd53-2e26790fa9eb,"same word+POS, diff Arabic def"
efbad1b4-e31b-4997-9382-b811864a1985,unprecedented,5,1,Civilization Collapse,adjective,لا مثيل له، غير مسبوق، فريد من نوعه,The pandemic created unprecedented challenges for healthcare systems worldwide.,False,False,0480456b-0d8c-47a6-a2c5-5b055e73de20,"same word+POS, diff Arabic def"
6ec4df94-8dfc-4458-aadd-d07db61290ed,enigmatic,5,1,Civilization Collapse,adjective,غامض، محيّر، صعب الفهم أو التفسير,The professor's enigmatic smile left students wondering what he really thought about their presentat,False,False,24a3a4d3-43cf-4874-ac69-831789d94293,"same word+POS, diff Arabic def"
63f95d2f-46fc-4aeb-862d-f05cbcc231e6,confluence,5,1,Civilization Collapse,noun,تقاطع، التقاء، اجتماع عوامل متعددة,"The company's success was due to a confluence of good timing, skilled leadership, and market demand.",False,False,a95b827c-4791-43de-a40f-febe7658e2ba,"same word+POS, diff Arabic def"
b2e12edd-dd7a-44d2-a1c6-7f81ac6386f0,insidious,5,1,Civilization Collapse,adjective,خبيث، يتطور تدريجياً بطريقة خفية لكن يسبب ضرراً جدياً,Social media addiction is insidious because its harmful effects develop slowly over time.,False,False,5cff3c69-2bf1-457a-9ec8-46a6ca1cf028,"same word+POS, diff Arabic def"
6f904119-4f05-4006-a1a8-405ffc4d59dc,protracted,5,1,Civilization Collapse,adjective,طويل الأمد، ممتد لفترة أطول من المتوقع أو المرغوب,The protracted negotiations between the two countries lasted over eighteen months.,False,False,716c7c5f-37aa-4f5a-ad17-52531919d8bb,"same word+POS, diff Arabic def"
7cb2afd6-279e-4724-b1ce-1e45fa9996eb,vulnerabilities,5,1,Civilization Collapse,noun,نقاط ضعف، مواطن خلل، قابلية للإصابة,The cybersecurity audit identified several vulnerabilities in the company's network.,False,False,b0c3d94d-6698-4ff9-8a34-5cd2e8d0debe,"same word+POS, diff Arabic def"
2b6625a1-b4a1-4aee-b3a6-53804f82e585,periphery,5,1,Civilization Collapse,noun,الأطراف، الحافة الخارجية؛ الجزء الأقل أهمية من مجموعة أو نشاط,"Housing costs in the city center are high, so many families live on the periphery.",False,False,31199191-b7f8-419f-a67a-b5ab5899c9d4,"same word+POS, diff Arabic def"
f365dc41-f3dc-41d1-9b04-406562750812,vulnerable,5,1,Civilization Collapse,adjective,عرضة للخطر، قابل للإصابة، ضعيف,Coastal cities are particularly vulnerable to rising sea levels.,False,False,8c0bccee-a060-44a1-a72e-d562ea9e68a3,"same word+POS, diff Arabic def"
e45bbbcd-2f98-4d37-b79e-7dfe1884218a,deteriorate,5,1,Civilization Collapse,verb,يتدهور، يتراجع، يسوء,"Without proper maintenance, the building's structure began to deteriorate rapidly.",False,False,aaa37ae3-6764-4edb-acc4-7bffe5738a0b,"same word+POS, diff Arabic def"
b0149786-09bb-4431-b28f-77753b2d558f,legitimacy,5,1,Civilization Collapse,noun,الشرعية، صفة كون الشيء مقبولاً أو معقولاً أو صحيحاً حسب القانون,The new government worked hard to establish its legitimacy among the population.,False,False,ad36ba2f-90a3-4949-b5cb-6ed9d6b93c9b,"same word+POS, diff Arabic def"
f651f155-f446-4c3f-9568-47d43a4bc80f,prescient,5,1,Civilization Collapse,adjective,بصير، يتنبأ بالأحداث قبل وقوعها؛ يظهر بُعد النظر,The economist's prescient analysis predicted the market crash three months early.,False,False,e97d8a55-82aa-4950-9f0b-4f3525308f29,"same word+POS, diff Arabic def"
1f7f6db6-d0e9-466a-9381-da18449e22c3,exacerbate,5,1,Civilization Collapse,verb,يفاقم، يزيد سوءاً، يشتد,The hot weather will exacerbate the drought conditions in the region.,False,False,e4c0e441-46be-464b-a31d-89421c19bbe8,"same word+POS, diff Arabic def"
5b3834e1-f53c-432f-844a-1c68c8329f41,magnitude,5,1,Civilization Collapse,noun,الحجم الكبير، الأهمية، أو شدة شيء ما,The magnitude of the earthquake's damage became clear only after several days.,False,False,d964dbcd-0187-425b-9194-18807c23b4b9,"same word+POS, diff Arabic def"
b6e803ee-bc3a-4689-89bd-6be909ec3cdf,sophisticated,5,1,Civilization Collapse,adjective,متطور، معقد، راقي,The new software uses sophisticated algorithms to predict market trends.,False,False,3435df7a-8be5-4ce8-9866-28f89eb87c21,"same word+POS, diff Arabic def"
a9a56f5b-6a70-432a-9e30-f65fc36b1ae8,poignant,5,1,Civilization Collapse,adjective,مؤثر، يثير مشاعر قوية من الحزن أو التعاطف أو التأثر العاطفي,The photograph of the abandoned school was a poignant symbol of the town's decline.,False,False,af0f8d70-d8c7-480e-9ebc-492e55209c94,"same word+POS, diff Arabic def"
79ba4884-c9e6-41fa-8a25-cdab0edf4879,formidable,5,2,Extreme Achievement,adjective,هائل، مخيف، قوي,The chess champion proved to be a formidable opponent who rarely lost a match.,False,False,8be33f05-901a-4996-8b95-6ad8009e3dde,"same word+POS, diff Arabic def"
197270b6-c552-48cd-af66-9e540931f496,audacious,5,2,Extreme Achievement,adjective,جريء، مغامر، يتسم بالجرأة والشجاعة,The startup's audacious plan to revolutionize transportation attracted significant investment.,False,False,4e5f9040-b742-4330-b466-c2f7f98e2549,"same word+POS, diff Arabic def"
9f467a26-a190-4155-82dc-699028c1013e,audacious,5,2,Extreme Achievement,adjective,جريء، مغامر، جسور,The startup's audacious plan to revolutionize transportation attracted millions in funding.,False,False,4e5f9040-b742-4330-b466-c2f7f98e2549,"same word+POS, diff Arabic def"
f39bc99b-80d8-47c5-8568-6ca346d76735,ingenuity,5,2,Extreme Achievement,noun,الإبداع، البراعة، القدرة على الابتكار والحلول الذكية,The engineer's ingenuity in designing the bridge saved the project millions of dollars.,False,False,20016d96-4385-4c3e-8697-6ae98ccdb57f,"same word+POS, diff Arabic def"
c6c80fcb-786d-4aad-9def-fd9c7d4193ba,paradigmatic,5,2,Extreme Achievement,adjective,نموذجي، مثالي، نمطي,The iPhone was paradigmatic of how smartphones would revolutionize communication.,False,False,8b805875-0004-4aeb-a48d-7c855e2b1ed8,"same word+POS, diff Arabic def"
ffae8c36-9317-4976-99c8-8a5f2270df94,unprecedented,5,2,Extreme Achievement,adjective,لم يحدث أو يُعرف من قبل؛ لا يوجد له مثال سابق,The company achieved unprecedented growth in the technology sector last year.,False,False,823fb73a-80a2-46e8-bd7a-d7822836aed1,"same word+POS, diff Arabic def"
3da8e6d7-1d34-49e0-a965-e805d03e823e,unprecedented,5,2,Extreme Achievement,adjective,غير مسبوق، لم يحدث من قبل، استثنائي,The pandemic caused unprecedented disruption to global supply chains.,False,False,823fb73a-80a2-46e8-bd7a-d7822836aed1,"same word+POS, diff Arabic def"
38046376-789c-44e7-a26d-41209004c86e,inconceivable,5,2,Extreme Achievement,adjective,لا يمكن تصوره، مستحيل التصديق، غير قابل للفهم,It was inconceivable that such a small error could cause the entire system to fail.,False,False,0b38f018-3a56-4e14-8df4-6a0aabf0af3a,"same word+POS, diff Arabic def"
adcdf542-eafe-418a-9843-e3d9b86b8695,inconceivable,5,2,Extreme Achievement,adjective,لا يمكن تصوره، غير قابل للتصديق، مستحيل الفهم,It was inconceivable that such a small company could compete with industry giants.,False,False,0b38f018-3a56-4e14-8df4-6a0aabf0af3a,"same word+POS, diff Arabic def"
b1a1c284-4b11-472c-8633-8472b015a9df,magnitude,5,2,Extreme Achievement,noun,الحجم، المقدار، الأهمية الكبيرة لشيء ما,The magnitude of climate change effects will require global cooperation to address.,False,False,950955c7-fcca-46a7-9b8e-ba14c4387f29,"same word+POS, diff Arabic def"
97aad932-eaf1-4483-ac0e-eb8620ad29fe,confluence,5,2,Extreme Achievement,noun,تلاقي، اجتماع، تضافر,The economic crisis resulted from a confluence of rising inflation and declining employment.,False,False,70a1909e-9cf1-46a0-9164-b5930208e424,"same word+POS, diff Arabic def"
